{
	"tailwind": {
		"config": "tailwind.config.js",
		"css": "src/app.css",
		"baseColor": "zinc"
	},
	"aliases": {
		"components": "$lib/components",
		"utils": "$lib/utils",
		"ui": "$lib/components/ui",
		"hooks": "$lib/hooks"
	},
	"typescript": false,
	"registry": "https://shadcn-svelte.com/registry"
}
